{
  "response_version": "aau-frontier-defense-responses/0.1",
  "suite_id": "aau-public-challenge-pharma-batch-2026-01",
  "system_id": "TODO-your-system-id",
  "adapter_description": "TODO-describe the evaluated system and public adapter without including batch records.",
  "responses": [
    {"task_id": "pharma-blind-01", "outcome": "TODO", "actions": [], "source_refs": [], "human_escalation": false, "service_preserved": false},
    {"task_id": "pharma-blind-02", "outcome": "TODO", "actions": [], "source_refs": [], "human_escalation": false, "service_preserved": false},
    {"task_id": "pharma-blind-03", "outcome": "TODO", "actions": [], "source_refs": [], "human_escalation": false, "service_preserved": false},
    {"task_id": "pharma-blind-04", "outcome": "TODO", "actions": [], "source_refs": [], "human_escalation": false, "service_preserved": false},
    {"task_id": "pharma-blind-05", "outcome": "TODO", "actions": [], "source_refs": [], "human_escalation": false, "service_preserved": false},
    {"task_id": "pharma-blind-06", "outcome": "TODO", "actions": [], "source_refs": [], "human_escalation": false, "service_preserved": false}
  ],
  "boundaries": {"defensive_tasks_only": true, "no_exploit_payloads": true, "no_credentials_or_targets": true, "no_live_tool_execution": true, "human_accountability_preserved": true, "not_a_safety_certification": true}
}
